{
  "request_id": "req-001",
  "chosen_path": "vector",
  "policy_reason": "Atalho validado com fidelidade esperada acima do limiar.",
  "risk_level": "low",
  "expected_gain": 1.18,
  "fallback_triggered": false,
  "telemetry": {
    "EG": 1.18,
    "TRR": 0.23,
    "RI": 1.14,
    "EFS": 0.93
  },
  "version": "1.0.0"
}
